{
  "$schema": "https://json-schema.org/draft/2020-12/schema",
  "type": "object",
  "properties": {
    "title": {
      "type": "string"
    },
    "legacyPath": {
      "type": "string"
    },
    "datePublished": {
      "type": "string"
    },
    "authors": {
      "type": "array",
      "items": {
        "type": "string"
      }
    },
    "tags": {
      "default": [],
      "type": "array",
      "items": {
        "type": "string"
      }
    },
    "rawCategories": {
      "default": [],
      "type": "array",
      "items": {
        "type": "string"
      }
    },
    "primaryCategory": {
      "default": null,
      "type": [
        "string",
        "null"
      ]
    },
    "section": {
      "type": "string"
    },
    "year": {
      "type": "integer",
      "minimum": -9007199254740991,
      "maximum": 9007199254740991
    },
    "venue": {
      "default": null,
      "type": [
        "string",
        "null"
      ]
    },
    "subtitle": {
      "default": null,
      "type": [
        "string",
        "null"
      ]
    },
    "theme": {
      "default": null,
      "type": [
        "string",
        "null"
      ]
    },
    "dates": {
      "default": null,
      "type": [
        "string",
        "null"
      ]
    },
    "$schema": {
      "type": "string"
    }
  },
  "required": [
    "title",
    "legacyPath",
    "datePublished",
    "authors",
    "section",
    "year"
  ]
}