{
  "title": "\"Sovereign Grace\"",
  "legacyPath": "/conference/category/sovereign-grace-galasheils-scotland-1994",
  "datePublished": "2014-04-26 10:36:19",
  "authors": [
    "manuelkuhs@gmail.com"
  ],
  "tags": [
    "1994"
  ],
  "rawCategories": [
    "lectures"
  ],
  "primaryCategory": "lectures",
  "year": 0,
  "subtitle": "\"Sovereign Grace\"",
  "theme": "\"Sovereign Grace\"",
  "venue": "Galasheils, Scotland, 1994",
  "section": "conference"
}