{
  "title": "\"The Kingdom of God\"",
  "legacyPath": "/conference/category/the-kingdom-of-god-cefn-lea-wales-2000",
  "datePublished": "2014-04-26 10:40:38",
  "authors": [
    "manuelkuhs@gmail.com"
  ],
  "tags": [
    "2000"
  ],
  "rawCategories": [
    "lectures"
  ],
  "primaryCategory": "lectures",
  "year": 0,
  "subtitle": "\"The Kingdom of God\"",
  "theme": "\"The Kingdom of God\"",
  "venue": "Cefn Lea, Wales, 2000",
  "section": "conference"
}