{
  "title": "\"Behold, I Come Quickly: The Reformed, Biblical Truth of the End\"",
  "legacyPath": "/conference/category/2016-behold-i-come-quickly-the-reformed-biblical-truth-of-the-end",
  "datePublished": "2014-09-21 21:54:11",
  "authors": [
    "manuelkuhs@gmail.com"
  ],
  "tags": [
    "2016"
  ],
  "rawCategories": [
    "past"
  ],
  "primaryCategory": "past",
  "year": 2016,
  "subtitle": "\"Behold, I Come Quickly: The Reformed, Biblical Truth of the End\"",
  "theme": "\"Behold, I Come Quickly: The Reformed, Biblical Truth of the End\"",
  "venue": "Castlewellan, Northern Ireland",
  "dates": "16-23 July",
  "section": "conference"
}