{
  "title": "\"Behold, I Come Quickly: The Reformed, Biblical Doctrine of the End\"",
  "legacyPath": "/conference/category/behold-i-come-quickly-the-reformed-biblical-doctrine-of-the-end-castlewellan-castle-2016",
  "datePublished": "2017-01-08 16:38:02",
  "authors": [
    "manuelkuhs@gmail.com"
  ],
  "tags": [
    "2016"
  ],
  "rawCategories": [
    "lectures"
  ],
  "primaryCategory": "lectures",
  "year": 0,
  "subtitle": "\"Behold, I Come Quickly: The Reformed, Biblical Doctrine of the End\"",
  "theme": "\"Behold, I Come Quickly: The Reformed, Biblical Doctrine of the End\"",
  "venue": "Castlewellan Castle, 2016",
  "section": "conference"
}